{
  "schema_version": "fda.artifact_inventory.v0",
  "generated_at_unix_seconds": 1782540000,
  "artifacts": [
    {
      "artifact_id": "ART-FDA-MCP-001",
      "artifact_type": "mcp_agent_invocation_plan",
      "title": "MCP Agent Invocation Plan",
      "producer_agent": "forge-delivery-agent",
      "related_program_id": "FDA-V1",
      "related_epic_id": "EPIC-FDA-V1-MCP",
      "related_case_ids": ["CASE-FDA-V1-MCP-001"],
      "related_task_ids": ["TASK-FDA-V1-IMPLEMENTER", "TASK-FDA-V1-FQA", "TASK-FDA-V1-SQA"],
      "latest_version": "v0",
      "preview_summary": "Implementer / Functional QA / Security QA を分離した MCP invocation plan。",
      "path_or_url": "docs/standards/delivery-artifacts-v0/examples/fda_v1_mcp_invocation_contract/mcp_agent_invocation_plan.json",
      "open_in_editor_link": null,
      "open_in_browser_link": null,
      "diff_link": null,
      "evidence_links": ["agent_role_policy.json"],
      "created_at_unix_seconds": 1782540000,
      "updated_at_unix_seconds": 1782540000
    },
    {
      "artifact_id": "ART-FDA-MCP-002",
      "artifact_type": "mcp_tool_call_receipt",
      "title": "MCP Tool Call Receipt",
      "producer_agent": "forge-delivery-agent",
      "related_program_id": "FDA-V1",
      "related_epic_id": "EPIC-FDA-V1-MCP",
      "related_case_ids": ["CASE-FDA-V1-MCP-001"],
      "related_task_ids": ["TASK-FDA-V1-IMPLEMENTER"],
      "latest_version": "v0",
      "preview_summary": "MCP tool resultをsemantic receiptへ変換した例。",
      "path_or_url": "docs/standards/delivery-artifacts-v0/examples/fda_v1_mcp_invocation_contract/mcp_tool_call_receipt.json",
      "open_in_editor_link": null,
      "open_in_browser_link": null,
      "diff_link": null,
      "evidence_links": ["mcp_agent_invocation_plan.json"],
      "created_at_unix_seconds": 1782540000,
      "updated_at_unix_seconds": 1782540000
    },
    {
      "artifact_id": "ART-FDA-MCP-003",
      "artifact_type": "coding_agent_thread_state",
      "title": "Coding Agent Thread State",
      "producer_agent": "forge-delivery-agent",
      "related_program_id": "FDA-V1",
      "related_epic_id": "EPIC-FDA-V1-MCP",
      "related_case_ids": ["CASE-FDA-V1-MCP-001"],
      "related_task_ids": ["TASK-FDA-V1-IMPLEMENTER"],
      "latest_version": "v0",
      "preview_summary": "repair loopで同じcoding agent threadを継続するための状態。",
      "path_or_url": "docs/standards/delivery-artifacts-v0/examples/fda_v1_mcp_invocation_contract/coding_agent_thread_state.json",
      "open_in_editor_link": null,
      "open_in_browser_link": null,
      "diff_link": null,
      "evidence_links": ["mcp_tool_call_receipt.json"],
      "created_at_unix_seconds": 1782540000,
      "updated_at_unix_seconds": 1782540000
    },
    {
      "artifact_id": "ART-FDA-MCP-004",
      "artifact_type": "planned_pr_execution_packet",
      "title": "Planned PR Execution Packet",
      "producer_agent": "forge-delivery-agent",
      "related_program_id": "FDA-V1",
      "related_epic_id": "EPIC-FDA-V1-MCP",
      "related_case_ids": ["CASE-FDA-V1-MCP-001"],
      "related_task_ids": ["TASK-FDA-V1-IMPLEMENTER"],
      "latest_version": "v0",
      "preview_summary": "planned PRを外部/MCP実装者へ渡す実行packet。",
      "path_or_url": "docs/standards/delivery-artifacts-v0/examples/fda_v1_mcp_invocation_contract/planned_pr_execution_packet.json",
      "open_in_editor_link": null,
      "open_in_browser_link": null,
      "diff_link": null,
      "evidence_links": ["mcp_agent_invocation_plan.json"],
      "created_at_unix_seconds": 1782540000,
      "updated_at_unix_seconds": 1782540000
    },
    {
      "artifact_id": "ART-FDA-MCP-005",
      "artifact_type": "agent_role_policy",
      "title": "Agent Role Policy",
      "producer_agent": "forge-delivery-agent",
      "related_program_id": "FDA-V1",
      "related_epic_id": "EPIC-FDA-V1-MCP",
      "related_case_ids": ["CASE-FDA-V1-MCP-001"],
      "related_task_ids": ["TASK-FDA-V1-IMPLEMENTER", "TASK-FDA-V1-FQA", "TASK-FDA-V1-SQA"],
      "latest_version": "v0",
      "preview_summary": "Implementerはwrite、QAはread-onlyとするrole policy。",
      "path_or_url": "docs/standards/delivery-artifacts-v0/examples/fda_v1_mcp_invocation_contract/agent_role_policy.json",
      "open_in_editor_link": null,
      "open_in_browser_link": null,
      "diff_link": null,
      "evidence_links": [],
      "created_at_unix_seconds": 1782540000,
      "updated_at_unix_seconds": 1782540000
    },
    {
      "artifact_id": "ART-FDA-MCP-006",
      "artifact_type": "dry_run_receipt",
      "title": "MCP Dry-run Receipt",
      "producer_agent": "forge-delivery-agent",
      "related_program_id": "FDA-V1",
      "related_epic_id": "EPIC-FDA-V1-MCP",
      "related_case_ids": ["CASE-FDA-V1-MCP-001"],
      "related_task_ids": ["TASK-FDA-V1-IMPLEMENTER"],
      "latest_version": "v0",
      "preview_summary": "Codex MCP tools/list、cwd、prompt、approval policy、禁止事項、target repo mutationなしを検証したdry-run receipt。",
      "path_or_url": "docs/standards/delivery-artifacts-v0/examples/fda_v1_mcp_invocation_contract/dry_run_receipt.json",
      "open_in_editor_link": null,
      "open_in_browser_link": null,
      "diff_link": null,
      "evidence_links": ["mcp_agent_invocation_plan.json", "mcp_tool_call_receipt.json"],
      "created_at_unix_seconds": 1782540000,
      "updated_at_unix_seconds": 1782540000
    }
  ],
  "groups": [
    {
      "group_id": "mcp_invocation_contract",
      "title": "MCP Invocation Contract",
      "artifact_ids": ["ART-FDA-MCP-001", "ART-FDA-MCP-002", "ART-FDA-MCP-003", "ART-FDA-MCP-004", "ART-FDA-MCP-005", "ART-FDA-MCP-006"]
    }
  ]
}
